{
  "cv_identity_mode": "",
  "target_headline": "",
  "professional_thesis": "",
  "signature_proof_points": [],
  "evidence_excluded": [],
  "projects_selected": [],
  "projects_excluded": [],
  "current_role_bullet_order_rationale": "",
  "first_page_evidence_markers": {"target_identity": "", "technical_stack": [], "strongest_achievement": "", "operating_context": "", "consequence": ""},
  "results": {"final_word_count": null, "final_page_count": null, "first_page_sufficiency": "pending", "identity_consistency": "pending", "evidence_integrity": "pending", "layout_quality": "pending"}
}
